{
  "created_at": "2026-09-25T11:00:00Z",
  "files": [
    {
      "bytes": 211,
      "path": "README.md",
      "sha256": "edc5dbfb07a1f4deeef85a9f64136cede130614bfd60bcab46185c8e16c67a3d"
    },
    {
      "bytes": 2604,
      "path": "index.json",
      "sha256": "fd12f1be589758e5d93f683138072454f569b73ffaddb1f5c40bc344f94fe7d1"
    },
    {
      "bytes": 316,
      "path": "proofs/3b7db4cb049f0d74c7220245e936e5db4b5c5cf0e76a4618488fdb5cf72e05a3.json",
      "sha256": "3b7db4cb049f0d74c7220245e936e5db4b5c5cf0e76a4618488fdb5cf72e05a3"
    },
    {
      "bytes": 345,
      "path": "proofs/3b7db4cb049f0d74c7220245e936e5db4b5c5cf0e76a4618488fdb5cf72e05a3.sig.json",
      "sha256": "22dfe0210a1beb50a9664b403aa9ce9e35fa45087f5eb6595f6228228d1a5802"
    },
    {
      "bytes": 304,
      "path": "proofs/58db0515e74b102d052c06e202fe34636c068e6dfc45352ef669f53c241a7cfd.json",
      "sha256": "58db0515e74b102d052c06e202fe34636c068e6dfc45352ef669f53c241a7cfd"
    },
    {
      "bytes": 345,
      "path": "proofs/58db0515e74b102d052c06e202fe34636c068e6dfc45352ef669f53c241a7cfd.sig.json",
      "sha256": "d90cc06004d48c6a6dd9da2e0cffa05a03c4a8e8e4a95bfe2c8778602af5e431"
    },
    {
      "bytes": 311,
      "path": "proofs/c756e288a9502bc82f01f6a4d8eb26812dce9ae5148dfa76991da7468e70f906.json",
      "sha256": "c756e288a9502bc82f01f6a4d8eb26812dce9ae5148dfa76991da7468e70f906"
    },
    {
      "bytes": 345,
      "path": "proofs/c756e288a9502bc82f01f6a4d8eb26812dce9ae5148dfa76991da7468e70f906.sig.json",
      "sha256": "37fd6da2ea4e92d21d063d0063869e6ad4e42412123b53ec4fde19abea6eac7b"
    },
    {
      "bytes": 176,
      "origin": "pubky://8nwd7x787d4xxy6r349npowdz136ibmmnpmyk1m8oxw6faa6oigy/pub/slime-example/tags/shop-1.json",
      "path": "records/8nwd7x787d4xxy6r349npowdz136ibmmnpmyk1m8oxw6faa6oigy/pub/slime-example/tags/shop-1.json",
      "sha256": "ea1461ba8b814b6c74c88a71de988c4a68aee4f35e66f0a3d73a3e9d915aebb9"
    },
    {
      "bytes": 176,
      "origin": "pubky://by8p8hf7i95w89niyfpkauy6j37kg9ehru5wrm9dfp1pg3pr7c5o/pub/slime-example/tags/print-2.json",
      "path": "records/by8p8hf7i95w89niyfpkauy6j37kg9ehru5wrm9dfp1pg3pr7c5o/pub/slime-example/tags/print-2.json",
      "sha256": "8221b438d4e800bc5490535c1418eec60106e5abd0d0109d3b61038d30a02fd2"
    },
    {
      "bytes": 108,
      "origin": "pubky://kq47ts1oghjief4acyjc7q8nuut5iodyw48atubb5d9h1gmoz1no/pub/slime-example/blobs/dc0a6bcfa8b224dadda57c997ec68bf786c1d2a6d479c958b52c12b8c0b44135",
      "path": "records/kq47ts1oghjief4acyjc7q8nuut5iodyw48atubb5d9h1gmoz1no/pub/slime-example/blobs/dc0a6bcfa8b224dadda57c997ec68bf786c1d2a6d479c958b52c12b8c0b44135",
      "sha256": "dc0a6bcfa8b224dadda57c997ec68bf786c1d2a6d479c958b52c12b8c0b44135"
    },
    {
      "bytes": 634,
      "origin": "pubky://kq47ts1oghjief4acyjc7q8nuut5iodyw48atubb5d9h1gmoz1no/pub/slime-example/listings/print-2.json",
      "path": "records/kq47ts1oghjief4acyjc7q8nuut5iodyw48atubb5d9h1gmoz1no/pub/slime-example/listings/print-2.json",
      "sha256": "f83c6058dec437d083a59df31009937129fece0f9b735c909ed64419a372d5a9"
    },
    {
      "bytes": 474,
      "origin": "pubky://kq47ts1oghjief4acyjc7q8nuut5iodyw48atubb5d9h1gmoz1no/pub/slime-example/listings/shirt-1.json",
      "path": "records/kq47ts1oghjief4acyjc7q8nuut5iodyw48atubb5d9h1gmoz1no/pub/slime-example/listings/shirt-1.json",
      "sha256": "99a2e249dcf6baf80b8deefe07a0851f54463b0bda5e13a0e09d5cb398d1e640"
    },
    {
      "bytes": 326,
      "origin": "pubky://kq47ts1oghjief4acyjc7q8nuut5iodyw48atubb5d9h1gmoz1no/pub/slime-example/shop.json",
      "path": "records/kq47ts1oghjief4acyjc7q8nuut5iodyw48atubb5d9h1gmoz1no/pub/slime-example/shop.json",
      "sha256": "d470c2bf78ebf40c4a58834e4282209f4d33eb1701cbfe4c482d7f6752b21c24"
    }
  ],
  "format": "slime-set/1",
  "previous": "sha256:499b2299c5ab09c5af41a4eed12cd09a8bef1415f01c8e81772c6c2ccb2b26b0"
}
