{
  "created_at": "2026-09-23T13:00:00Z",
  "files": [
    {
      "bytes": 145,
      "path": "README.md",
      "sha256": "206eba6f5a997fdf76c9c637c9e6230e16c75d3024c6b904a607e335ae32f7cc"
    },
    {
      "bytes": 104,
      "origin": "pubky://dbnm5egbtdsk7c5hhufrbpmdxge6h7of7c83qc7wygy1m7qhug6y/pub/slime-example/tags/github-1.json",
      "path": "history/tag-1.json",
      "sha256": "4c559178fd99eb9ba50a779ea1fc35630611df103b0ad8e32d20a3085192d7a2"
    },
    {
      "bytes": 103,
      "origin": "pubky://dbnm5egbtdsk7c5hhufrbpmdxge6h7of7c83qc7wygy1m7qhug6y/pub/slime-example/tags/github-1.json",
      "path": "history/tag-2.json",
      "sha256": "38a11655ba48a6f7dfa56fbba06b0fd8e084c3ff33f6d54099d3e62b0492fc24"
    },
    {
      "bytes": 335,
      "path": "proofs/36d2fac2b4d0c67da293f23bd0498fc9f0393c99b495d64752d03e07934004bd.json",
      "sha256": "36d2fac2b4d0c67da293f23bd0498fc9f0393c99b495d64752d03e07934004bd"
    },
    {
      "bytes": 345,
      "path": "proofs/36d2fac2b4d0c67da293f23bd0498fc9f0393c99b495d64752d03e07934004bd.sig.json",
      "sha256": "65423a03ae35207ced14c5e819038885d8acc4894eeb5f9caf28c9fb19ff9846"
    },
    {
      "bytes": 313,
      "path": "proofs/a8b944d1895667d8d840b940cf7a3dd27c9445768f0d832dc4c231668309cf51.json",
      "sha256": "a8b944d1895667d8d840b940cf7a3dd27c9445768f0d832dc4c231668309cf51"
    },
    {
      "bytes": 345,
      "path": "proofs/a8b944d1895667d8d840b940cf7a3dd27c9445768f0d832dc4c231668309cf51.sig.json",
      "sha256": "e137dd7c4f84ba7240d51d65ef8cf82f7947aae1d5a9e195040d2baed0a2c239"
    },
    {
      "bytes": 394,
      "path": "proofs/f9151b27f4c45a3ff208285676034610803ff584f21de6193c914d0f876ca2f5.json",
      "sha256": "f9151b27f4c45a3ff208285676034610803ff584f21de6193c914d0f876ca2f5"
    },
    {
      "bytes": 345,
      "path": "proofs/f9151b27f4c45a3ff208285676034610803ff584f21de6193c914d0f876ca2f5.sig.json",
      "sha256": "dd7dce7ec3edfe6c9f437422ceb9c9a5601791b1352b74c0ba012d0604064790"
    }
  ],
  "format": "slime-set/1",
  "previous": "sha256:0f1350920bfc42293d6f840cde0c115f9cebaeb738dacf34b94749d4c42b7a30"
}
